text,cite_spans,ref_spans,section
"Human serum is derived from the liquid plasma component of the blood with the fibrinogens, or clotting factors, removed and is composed of small molecules such as salts, lipids, amino acids, sugars and approximately 60-80 mg of proteins/mL [1] . Serum is a readily obtainable peripheral bodily fluid from which the protein profile directly reflects the normal or disease state of the organism [2] [3] [4] . Serum is a complex mixture of ""classical"" and ""non-classical"" proteins. Classical serum proteins are involved in a number of processes including proteolysis, inhibition, binding, transport, coagulation, and immune response and are often secreted from the liver, through the intestines, and into the bloodstream [5] . ""Non-classical"" proteins are proteins that are not directly tied to any known function within the serum and often originate from cellular leakage or shedding, and may utilize the bloodstream for transportation [5] . It is generally accepted that most of the significant changes in the serum will be found in these low abundant non-classical proteins, due to the hypothesis that the presence of these proteins should reflect changes in the diseased tissue. Indeed, serum commonly contains upwards of 10,000 different proteins at any given time that are being actively produced and secreted by all cells and tissues, therefore, the proteomic profile of serum can give insight into the systemic reaction to a disease state and can serve as a pool of differentially expressed proteins [2, [6] [7] [8] [9] [10] [11] [12] [13] . Recently, the interest in characterizing the human serum proteome has increased due to the determination of disease biomarkers for early detection, diagnosis, and drug targeting; however, due to the extensive dynamic range of protein concentration within the serum, the identification of low abundance proteins suitable for biomarker determination is often masked. The 22 highly abundant proteins contained within serum constitute approximately 99% of the total serum proteins, including albumin, IgG, transferrin, haptoglobin, fibrinogen, etc. and interfere with the identification of low abundance proteins in the ng/mL concentration range. The presence of these highly abundant proteins necessitates the prefractionation of serum samples prior to analysis for low abundant proteins. Due to the dynamic insight the analysis of the serum proteome can relate to a disease state, of particular interest is the identification of low abundant proteins that change in expression or abundance in response to a disease state. These low abundant proteins could potentially arise as an early diagnostic for a disease state, or a therapeutic target.","[{'start': 240, 'end': 243, 'text': '[1]', 'ref_id': 'BIBREF0'}, {'start': 393, 'end': 396, 'text': '[2]', 'ref_id': 'BIBREF1'}, {'start': 397, 'end': 400, 'text': '[3]', 'ref_id': 'BIBREF2'}, {'start': 401, 'end': 404, 'text': '[4]', 'ref_id': 'BIBREF3'}, {'start': 718, 'end': 721, 'text': '[5]', 'ref_id': 'BIBREF4'}, {'start': 934, 'end': 937, 'text': '[5]', 'ref_id': 'BIBREF4'}, {'start': 1505, 'end': 1508, 'text': '[2,', 'ref_id': 'BIBREF1'}, {'start': 1509, 'end': 1512, 'text': '[6]', 'ref_id': 'BIBREF5'}, {'start': 1513, 'end': 1516, 'text': '[7]', 'ref_id': 'BIBREF6'}, {'start': 1517, 'end': 1520, 'text': '[8]', 'ref_id': 'BIBREF7'}, {'start': 1521, 'end': 1524, 'text': '[9]', 'ref_id': 'BIBREF8'}, {'start': 1525, 'end': 1529, 'text': '[10]', 'ref_id': 'BIBREF9'}, {'start': 1530, 'end': 1534, 'text': '[11]', 'ref_id': 'BIBREF10'}, {'start': 1535, 'end': 1539, 'text': '[12]', 'ref_id': 'BIBREF11'}, {'start': 1540, 'end': 1544, 'text': '[13]', 'ref_id': 'BIBREF12'}]",[],Background
"Serum proteomics has emerged as an integral biomarker identification and diagnostic tool, especially for infectious diseases and oncology. Recently, novel serum biomarkers have been identified for liver fibrosis in hepatitis C virus (HCV) infected patients as well as unique protein signatures in SARS coronavirus infections, and infant hepatitis syndrome induced by human cytomegalovirus (HCMV) infection [14] [15] [16] . Characterization of the serum protein profile of these viral states helps provide insight into the expression changes associated with viral infection. In particular, HIV-1 infection, even at the acute phase, results in dramatic changes in both cellular and viral protein expression levels. As the HIV-1 viral tropism consists primarily of CD4+ T-cells, macrophages, and dendritic cells, the resulting protein changes can be seen systemically as infected cells travel throughout the body. Additionally, the nature of this viral infection supports the secretion of altered proteins into the blood and subsequently the serum due to the propensity of the virus to stimulate apoptosis of infected cells, therefore emptying cellular contents into the serum. These characteristics of HIV-1 infection suggest that the analysis of the serum of infected patients is an appropriate reflection of a patients' altered protein expression state.","[{'start': 406, 'end': 410, 'text': '[14]', 'ref_id': 'BIBREF13'}, {'start': 411, 'end': 415, 'text': '[15]', 'ref_id': 'BIBREF14'}, {'start': 416, 'end': 420, 'text': '[16]', 'ref_id': 'BIBREF15'}]",[],Background
"Due to innate genetic and phenotypic differences in the human population, significant variability exists in the sus-ceptibility to HIV-1 infection. Amongst this diversity includes the well-studied CCR5Δ32 inherited mutation, which prevents the binding of R5-tropic HIV-1 strains to the CCR5 chemokine receptor on the surface of CD4+ Tcells, therefore preventing entry of the virus [17] . Additionally, some individuals can be infected with HIV-1, however will not progress to AIDS even in the absence of therapy. These Long Term Non-Progressors (LTNPs) are often characterized as being infected with HIV-1 but are also disease free and sustain a normal CD4 T-cell count and a low viral load. Over the past 20 years, multiple studies have been aimed at determining the reason that these individuals are able to resist disease progression. There are studies that suggest that the virus infecting these cells could be deficient in some way, for example, Nef deficient viruses and Vpr R77Q mutations are associated with LTNPs [18] [19] [20] [21] [22] . A number of host factors have also been identified that may contribute to the observed resistance. LTNPs have a higher prevalence of the CCR5Δ32 allele [17, [23] [24] [25] . In addition, the presence of certain HLA genes including HLA-B27, HLA-B*5701, HLA-B*5401, and HLA-B*1507 have been linked to LTNP [26] [27] [28] however, the identified alterations do not account for all cases of LTNP. Therefore, the search for protective host factors is still an area of active investigation in hopes of obtaining information that could be of therapeutic value.","[{'start': 381, 'end': 385, 'text': '[17]', 'ref_id': 'BIBREF16'}, {'start': 1022, 'end': 1026, 'text': '[18]', 'ref_id': 'BIBREF17'}, {'start': 1027, 'end': 1031, 'text': '[19]', 'ref_id': 'BIBREF18'}, {'start': 1032, 'end': 1036, 'text': '[20]', 'ref_id': 'BIBREF19'}, {'start': 1037, 'end': 1041, 'text': '[21]', 'ref_id': 'BIBREF20'}, {'start': 1042, 'end': 1046, 'text': '[22]', 'ref_id': 'BIBREF21'}, {'start': 1201, 'end': 1205, 'text': '[17,', 'ref_id': 'BIBREF16'}, {'start': 1206, 'end': 1210, 'text': '[23]', 'ref_id': 'BIBREF22'}, {'start': 1211, 'end': 1215, 'text': '[24]', 'ref_id': 'BIBREF23'}, {'start': 1216, 'end': 1220, 'text': '[25]', 'ref_id': 'BIBREF24'}, {'start': 1353, 'end': 1357, 'text': '[26]', 'ref_id': 'BIBREF25'}, {'start': 1358, 'end': 1362, 'text': '[27]', 'ref_id': 'BIBREF26'}, {'start': 1363, 'end': 1367, 'text': '[28]', 'ref_id': 'BIBREF27'}]",[],Background
"Here, we describe the detection of unique, low abundant serum proteins in latently infected HIV-1 LTNPs as compared to serum from patients undergoing HAART treatment, and those not infected with HIV-1. We attempted to characterize the underlying differences in LTNPs that contribute to the ability of these patients to combat HIV-1 infections. We have depleted 12 of the most highly abundant serum proteins from three sets of serum samples (uninfected, infected on HAART, LTNP) and identified differentially expressed proteins across the samples. In particular, we focus on the identified cellular protein p16 INK4A which is found preferentially in LTNP patient serum samples, but is not present in patients undergoing HAART treatment. In vitro viral assays and viability studies confirm the loss of viral replication upon p16 INK4A treatment in latently infected cell lines and the non-toxic effect of the same treatment in corresponding uninfected cell lines.",[],[],Background
"To begin the identification of unique serum proteins, we obtained 18 subject serum samples: six LTNP, six HIV-1 infected subjects receiving HAART therapy (HAART) and six HIV-uninfected individuals through the Washington DC site of the Women's Interagency HIV Study (WIHS) Georgetown site (Table 1) . WIHS is an NIH multicenter study of the natural history of HIV-1 infection in women [29] . LTNPs are defined by WIHS as being HIV-1 infected, but disease free for at least five years, having a CD4 count of greater than 500 at all visits and having no history of anti-retroviral therapy. The difficulty associated with analyzing serum is the presence of a high abundance of proteins which mask potential low abundance biomarkers. To overcome this obstacle, we utilized the ProteomeLab IgY serum depletion kit which removes 12 of the most abundant proteins in serum: albumin, IgG, transferrin, fibrinogen, IgA, α2-macroglobulin, IgM, α1antitrypsin, haptoglobin, α1-acid glycoprotein, apolipoprotein A-I, and apolipoprotein A-II. As can be observed in Figure 1A , whole serum (lanes 2, 3) contains many proteins and is too complex to allow for confident identification of specific proteins. However, when the high abundant proteins (Figure 1 , lanes 8, 9) are removed, lower abundant proteins that were originally masked ( Figure 1 , lanes 4, 5) are able to be analyzed. Along these lines, we found the ProteomeLab IgY serum depletion kit to be the most appropriate and reproducible manner in which to fractionate our serum samples into high and low abundant fractions. We applied this depletion strategy to pooled patient samples, combining equal volumes of whole serum from each of the six patients per sample set (LTNP, HAART, and Negative), which were subsequently depleted into low and high abundance fractions. We began the analysis with pooled samples to assist in the identification of HIV-1 infection specific protein identification as opposed to identifying individual patient and serum variability. These pooled samples were separated based on 1D SDS-PAGE ( Figure 1B ) and comparisons between LTNP, HAART, and Negative low abundant samples were carried out via in-gel trypsin digestion, peptide elution and desalting, followed by MALDI-TOF mass spectrometry as indicated by numbered arrows marking excised bands. The subsequent protein identifications served as a preliminary indication of differentially expressed proteins between the three patient types. These observations, as summarized in Table 2 , provide an insight into the relevance of proteins identified in the context of the state of HIV-1 infection. Of particular interest in Table 2 is the identification of HIV-1 enhancer binding protein 1, (HIVEP1), Ribonuclease III, and heterochromatin protein 1 binding protein in the low abundance LTNP fraction. HIVEP1 is a member of the ZAS family of proteins which bind the promoter and enhancer regions of both cellular genes and infectious viruses, including HIV-1. Also known as PRDII-BF1 or MBP-1, this transcription factor binds to both the NF-κB and the TAR transactivation response DNA elements on the HIV-1 LTR in both the presence and absence of HIV-1 Tat [30, 31] . It is not surprising that a transcription factor such as HIVEP1 would be present during HIV-1 infection; however, the identification of this protein is not necessarily a marker for a LTNP phenotype. Ribonuclease III, or Drosha, is a cellular enzyme found in the nucleus which serves to cleave double-stranded RNA hairpin transcripts as a key step in the production of miRNAs in the RNA interference pathway. Interestingly, heterochromatin protein 1, or HP1 is a member of the chromatin remodeling family of proteins, which can bind histones at methylated lysine residues and can interact with many chromatin-associated nonhistone proteins. The HP1 family of proteins has been associated with promoting a heterochromatic cellular state, where latently HIV-1 infected cells can persist as a transcriptionally silent provirus [32, 33] . It may be of interest that an HP1 binding protein would be present in the serum of an HIV-1 infected patient as HP1, including its subtypes α, β, and γ, could be involved in the control of various stages of infection. It is possible that the association of this HP1 binding protein with varying subtype of HP1 could explain the differences in patient phenotypes, especially those that result in an altered susceptibility to viral infection.","[{'start': 384, 'end': 388, 'text': '[29]', 'ref_id': 'BIBREF28'}, {'start': 1247, 'end': 1249, 'text': '8,', 'ref_id': 'BIBREF7'}, {'start': 1250, 'end': 1252, 'text': '9)', 'ref_id': 'BIBREF8'}, {'start': 3180, 'end': 3184, 'text': '[30,', 'ref_id': 'BIBREF29'}, {'start': 3185, 'end': 3188, 'text': '31]', 'ref_id': 'BIBREF30'}, {'start': 4014, 'end': 4018, 'text': '[32,', 'ref_id': 'BIBREF31'}, {'start': 4019, 'end': 4022, 'text': '33]', 'ref_id': 'BIBREF32'}]","[{'start': 288, 'end': 297, 'text': '(Table 1)', 'ref_id': 'TABREF0'}, {'start': 1049, 'end': 1058, 'text': 'Figure 1A', 'ref_id': 'FIGREF0'}, {'start': 1229, 'end': 1238, 'text': '(Figure 1', 'ref_id': 'FIGREF0'}, {'start': 1320, 'end': 1328, 'text': 'Figure 1', 'ref_id': 'FIGREF0'}, {'start': 2066, 'end': 2075, 'text': 'Figure 1B', 'ref_id': 'FIGREF0'}, {'start': 2503, 'end': 2510, 'text': 'Table 2', 'ref_id': 'TABREF1'}, {'start': 2648, 'end': 2655, 'text': 'Table 2', 'ref_id': 'TABREF1'}]",Depletion of the 12 highly abundant serum proteins allows for the identification of low abundant proteins
"Following the initial 1D separation and MALDI-TOF MS assisted identification, the pooled patient samples were subjected to 2D-gel electrophoresis (2DGE); isoelectric focusing (IEF) using IPG strips with a pH 3.0-10.0 range followed by SDS-PAGE using 4-20% Tris-Glycine Criterion gels. The method of 2D-gel electrophoresis is much more sensitive than 1D-gel electrophoresis in that it provides separation of a complex mixture of proteins in two dimensions, therefore removing the complexity associated with overlapping proteins, or masking due to posttranslational modifications. 2DGE is a more sensitive front-end purification approach to the isolation and identification of individual protein species by mass spectrometry. Figure 2 depicts the LTNP, HAART, and Negative low abundance fractions in gels ""a"", ""b"", and ""c"", respectively, as well as the LTNP, HAART, and Negative high abundance fractions in gels ""d"", ""e"", and ""f"", respectively. Indicated protein spots from all gels were excised based on a comparison of protein abundance and the presence of unique spots in a given patient set, were subjected to in-gel trypsin digestion, and were identified by MALDI-TOF mass spectrometry. It is important to note that although gels ""d,"" ""e,"" and ""f"" contain the majority of the high abundance proteins, unique small protein spots can still be visualized on these gels. This indicates that not only will these high abundant proteins mask proteins of interest; they can also interact with and seclude lower abundance proteins from being identified. Peak lists from the collected mass spectra were processed via peptide mass fingerprinting (PMF) analysis using the Mascot and ProFound databases, compared, and compiled into a nonexhaustive list of identified proteins as displayed in Table  3 . Of particular interest are those proteins identified from gel ""a"" indicating unique low abundance proteins in the serum of LTNP patients: Tropomyosin 3, protein kinase 3, and cdk4/6 binding protein p16. Tropomyosin interacts with actin filaments to provide stability and regulates other actin binding proteins. This family of proteins has been shown to be cleaved by HIV-1 protease in vitro, resulting in the dissociation of critical cytoskeletal elements, which may demonstrate the alteration of muscle structure in the presence of an HIV-1 infection [34] . Protein kinase 3, or Protein kinase C (PKC) is a member of the family of serine/threonine kinases that are integrally involved in key cellular signaling pathways and can phosphorylate a wide variety of substrates. Not surprisingly, HIV-1 infection alters the PKC phosphorylation pathway to stimulate TNF-α production by monocytes as well as other cytokines and growth factors such as IL-6, IL-10, and MCP-1 [35] [36] [37] [38] [39] . PKC has also been shown to be necessary for HIV-1 Tat-mediated transactivation as well as directly phosphorylating Tat at serine 46 [40, 41] and plays an integral role in the signaling and secretion of cytokines in response to HIV-1 envelope proteins gp120, gp160, and gp41 [42, 43] . Of particular interest in the low abundance, LTNP fraction is the presence of the cdk4/ cdk6 binding protein p16, or more specifically, p16 INK4A , a member of the inhibitor of kinase 4/alternative reading frame (INK4/ARF) family of endogenous cdk (cyclindependent kinase) inhibitors [44] . Dysregulation of the cell cycle, including the manipulation of cdks and their associated Cyclins is often a hallmark of cancerous and infectious phenotypes. Indeed HIV-1 and its associated proteins have been known to alter the phosphorylation state and activity of these kinases. P16 INK4A inhibits the phosphorylation of Rb by competitively inhibiting the association of cdk4/Cyclin D therefore inhibiting the release of Rb-bound proteins, such as E2F, and the subsequent progression into the S phase of the cell cycle [44, 45] . This small molecular weight protein is an attractive candidate for a secreted, differentially expressed protein in response to HIV-1 infection. In addition to these low abundant protein identifications, the LTNP high abundant samples (gel ""d"") indicated the presence of the FGFR1 oncogenic partner and PCTAIRE protein kinase 3 as well as an anti-HIV-1 gp120 IgG 16 cκ light chain. FGFR1 oncogene partnered with the fibroblast growth factor receptor 1 (FGFR1) is thought to be associated with myeloproliferative disorders and as of yet is not associated with any HIV-1 protein interactions or associated disease phenotypes. PCTAIRE protein kinase 3, however, is a member of the serine/threonine family of protein kinases and more specifically, the cdc2/cdkx subfamily that plays a role in broad signal transduction pathways. This serine/threonine kinase family member has also been associated with the essential regulation of cell cycle progression, as well as transcription and DNA repair [46] . This protein identification again demonstrates the role that HIV-1 infection plays in the dysregulation of cellular kinases and specifically, cell cycle progression.","[{'start': 2345, 'end': 2349, 'text': '[34]', 'ref_id': 'BIBREF33'}, {'start': 2759, 'end': 2763, 'text': '[35]', 'ref_id': 'BIBREF34'}, {'start': 2764, 'end': 2768, 'text': '[36]', 'ref_id': 'BIBREF35'}, {'start': 2769, 'end': 2773, 'text': '[37]', 'ref_id': 'BIBREF36'}, {'start': 2774, 'end': 2778, 'text': '[38]', 'ref_id': 'BIBREF37'}, {'start': 2779, 'end': 2783, 'text': '[39]', 'ref_id': 'BIBREF38'}, {'start': 2918, 'end': 2922, 'text': '[40,', 'ref_id': 'BIBREF39'}, {'start': 2923, 'end': 2926, 'text': '41]', 'ref_id': 'BIBREF40'}, {'start': 3060, 'end': 3064, 'text': '[42,', 'ref_id': 'BIBREF41'}, {'start': 3065, 'end': 3068, 'text': '43]', 'ref_id': 'BIBREF42'}, {'start': 3355, 'end': 3359, 'text': '[44]', 'ref_id': 'BIBREF43'}, {'start': 3882, 'end': 3886, 'text': '[44,', 'ref_id': 'BIBREF43'}, {'start': 3887, 'end': 3890, 'text': '45]', 'ref_id': 'BIBREF44'}, {'start': 4882, 'end': 4886, 'text': '[46]', 'ref_id': 'BIBREF45'}]","[{'start': 724, 'end': 732, 'text': 'Figure 2', 'ref_id': 'FIGREF2'}, {'start': 1782, 'end': 1790, 'text': 'Table  3', 'ref_id': 'TABREF3'}]","2DGE and MALDI-TOF analysis of pooled, depleted serum samples identified unique low abundance proteins"
"The HAART responder patient samples (gels ""b"" and ""e"") also contained unique protein candidates: serine/ threonine kinase 33, the Kelch repeat domain containing protein 11, and the SNW1 protein/APAF1 interacting protein in the low abundant fraction as well as the pre-Bcell leukemia homeobox interacting protein 1 in the high abundant fraction. Of functional interest is the general serine/threonine kinase 33 as we have already identified several cellular kinases of the same family. Additionally, the SNW1 protein is a transcriptional coactivator that induces the expression of vitamin D, retinoic acid, estrogen, and glucocorticoid associated genes. SNW1/SKIP interacts with HIV-1 Tat through the association with p-TEFb (cdk9/Cyclin T1) at the TAR RNA complex, stimulating HIV-1 transcription elongation [44] . Interestingly, some of the protein spots identified the presence of serum albumin contamination (spots a2, d5, d7, and e2), which both served as an internal positive control for mass spectrometry and also indicated that the depletion columns are not completely efficient at removing contaminating high abundant proteins.","[{'start': 808, 'end': 812, 'text': '[44]', 'ref_id': 'BIBREF43'}]",[],"2DGE and MALDI-TOF analysis of pooled, depleted serum samples identified unique low abundance proteins"
"In order to further confirm the presence of these proteins in the serum as identified by mass spectrometry, we performed western blots on the same low and high abundant pooled fractions ( Figure 3A ). P16 INK4A is present in both the low and high abundant fractions of the pooled LTNPs (lanes 3, 4) and is also observed in the high abundance fraction of uninfected patients ( Figure 3A , lane 2). Interestingly, this protein is not present in HAART patient samples at all ( Figure 3A , lane 5, 6). The presence of this protein in serum may be specific to individuals that confer resistance to chronic HIV-1 infection. As p16 INK4A is an inhibitor of cell cycle kinases, in particular cdk4 and cdk6, the levels of cdk4 in the serum samples was assayed and was shown to be ubiquitously expressed across all low and high abundance serum samples ( Figure 3A , third panel from top). Indeed, levels of cdk6 were not detectable in any of the patient serum samples as compared to a 293T whole cell extract positive control (data not shown).",[],"[{'start': 188, 'end': 197, 'text': 'Figure 3A', 'ref_id': 'FIGREF4'}, {'start': 376, 'end': 385, 'text': 'Figure 3A', 'ref_id': 'FIGREF4'}, {'start': 474, 'end': 483, 'text': 'Figure 3A', 'ref_id': 'FIGREF4'}, {'start': 844, 'end': 853, 'text': 'Figure 3A', 'ref_id': 'FIGREF4'}]",Validation of MS protein identifications by Western Blot
