text,cite_spans,ref_spans,section
"Our results indicate that pDCs from MS patients are differentially activated compared to pDCs from healthy donors in response to single strand RNA mimicked by Resiquimod. Interestingly, mDCs from the same individuals and activated with the same stimulus behave similarly in MS and healthy donors. This could be explained by the downstream signaling activated by TLR-7 and TLR-8 in pDCs and mDCs, respectively [20] . Moreover, fast indirect signaling pathways could also influence pDC activation. However, these results suggest a potential differential induction of T cell immune response induced by pDCs in MS patients compared to healthy donors. For instance, it is known that a TLR-7 agonist induces lytic properties of pDCs via the tumor necrosis factor-related apoptosis-inducing ligand (TRAIL), whose expression is directly correlated with individual viral loads in HIV+ patients [21] . Similarly, pDCs express granzyme B, which mediates killing of CD4 T cell during viral infections like HIV [22, 23] . Moreover, we reported that pDCs from MS patients stimulated with Resiquimod and co-cultured with naïve T cells significantly induce the secretion of IL-9, a cytokine produced by a new Th profile called Th9 [18] . Interestingly, in a mouse model it has been demonstrated that OX40-L, a costimulatory molecule that we found highly expressed in pDCs from MS patients, contributes to IL-9 polarization [24] . Here, we found that recombinant OX40L induce and amplify IL-9 production by human T cells, indicating that the interaction OX40-OX40-L between pDCs and T cells in MS patients could be responsible of the IL-9 induction observed in MS patients. Other costimulatory molecules upregulated in pDCs from MS patients, such as HLA-DR and CD86, are considered as the predominant molecules delivering ""first and second signals"" during T-cell activation [25] . Thus, our results indicate that OX40-L could be the crucial costimulatory molecule determining the fate of the immune response generated by pDCs. In fact, OX40 and OX40-L dictate the different type of effector (protective or pathogenic) T cells that accumulate in primary and secondary responses, as well as determine the frequency of memory T cells that are generated [26] . Ligation of OX40 can induce Tfh polarization [27, 28] , an inflammatory Th2 response [29] , Th1 and Th2 [30, 31] , Th9 [24] , Th17 [32] , and T regulatory cells [33] , depending on the context. Although OX40 + lymphocytes have been identified within active lesions of MS brain tissues [34] , the role of the OX40-OX40-L axis in MS is not elucidated.","[{'start': 409, 'end': 413, 'text': '[20]', 'ref_id': 'BIBREF19'}, {'start': 885, 'end': 889, 'text': '[21]', 'ref_id': 'BIBREF20'}, {'start': 998, 'end': 1002, 'text': '[22,', 'ref_id': 'BIBREF21'}, {'start': 1003, 'end': 1006, 'text': '23]', 'ref_id': 'BIBREF22'}, {'start': 1215, 'end': 1219, 'text': '[18]', 'ref_id': 'BIBREF17'}, {'start': 1407, 'end': 1411, 'text': '[24]', 'ref_id': 'BIBREF23'}, {'start': 1857, 'end': 1861, 'text': '[25]', 'ref_id': 'BIBREF24'}, {'start': 2233, 'end': 2237, 'text': '[26]', 'ref_id': 'BIBREF25'}, {'start': 2285, 'end': 2289, 'text': '[27,', 'ref_id': None}, {'start': 2290, 'end': 2293, 'text': '28]', 'ref_id': 'BIBREF27'}, {'start': 2325, 'end': 2329, 'text': '[29]', 'ref_id': 'BIBREF28'}, {'start': 2344, 'end': 2348, 'text': '[30,', 'ref_id': 'BIBREF29'}, {'start': 2349, 'end': 2352, 'text': '31]', 'ref_id': 'BIBREF30'}, {'start': 2359, 'end': 2363, 'text': '[24]', 'ref_id': 'BIBREF23'}, {'start': 2371, 'end': 2375, 'text': '[32]', 'ref_id': 'BIBREF31'}, {'start': 2401, 'end': 2405, 'text': '[33]', 'ref_id': 'BIBREF32'}, {'start': 2525, 'end': 2529, 'text': '[34]', 'ref_id': 'BIBREF33'}]",[],Discussion
"Moreover, OX40 signals can mediate CD8 immune responses, which is particularly relevant during viral infection. It has been demonstrated that the OX40-OX40-L axis can indirectly promote CD8 T cell priming through augmenting CD4 T cell help [35] , and directly enhances the expansion of memory CD8 T cell populations specific for viruses [36] , including EBV, which has been widely associated with MS [37, 38] . In MS, the frequency of CD8 + T cells specific for EBV lytic and latent antigens is higher in active and inactive MS patients, respectively, compared to healthy donors, underlying the importance of the activation of the anti-EBV response in MS [39] . In line with the effect of the OX40-OX40-L axis in CD8 T cell activation, OX40 agonistic therapy has proven a potent cancer immunotherapy, enhancing CD8 T cell tumor infiltration [40] . Moreover, our analysis indicated that the frequency of pDC subpopulations in the blood of MS patients does not differ significantly from that of healthy donors, according to the similar levels of CD80 and PDL-1 in pDCs from MS patients and healthy donors. However, the P1 subpopulation of pDCs has been associated to autoimmune diseases linked to pDC-derived type I interferon (IFN) [19] , such as psoriasis and lupus erythematous (SLE) [41] [42] [43] . However, the physiopathology of MS differs from SLE and psoriasis [44] . In fact, the majority of MS patients benefits from IFN-β therapy [45] ; that is, pDCs from MS patients produce lower levels of IFN-α compared to those derived by healthy donors [15] , and the serum levels of type I IFN as well as the response of PBMC to type I IFN in MS are lower compared to SLE patients [46] .","[{'start': 240, 'end': 244, 'text': '[35]', 'ref_id': 'BIBREF34'}, {'start': 337, 'end': 341, 'text': '[36]', 'ref_id': 'BIBREF35'}, {'start': 400, 'end': 404, 'text': '[37,', 'ref_id': 'BIBREF36'}, {'start': 405, 'end': 408, 'text': '38]', 'ref_id': 'BIBREF37'}, {'start': 655, 'end': 659, 'text': '[39]', 'ref_id': 'BIBREF38'}, {'start': 841, 'end': 845, 'text': '[40]', 'ref_id': 'BIBREF39'}, {'start': 1231, 'end': 1235, 'text': '[19]', 'ref_id': 'BIBREF18'}, {'start': 1285, 'end': 1289, 'text': '[41]', 'ref_id': 'BIBREF40'}, {'start': 1290, 'end': 1294, 'text': '[42]', 'ref_id': 'BIBREF41'}, {'start': 1295, 'end': 1299, 'text': '[43]', 'ref_id': 'BIBREF42'}, {'start': 1368, 'end': 1372, 'text': '[44]', 'ref_id': 'BIBREF43'}, {'start': 1440, 'end': 1444, 'text': '[45]', 'ref_id': 'BIBREF44'}, {'start': 1552, 'end': 1556, 'text': '[15]', 'ref_id': 'BIBREF14'}, {'start': 1681, 'end': 1685, 'text': '[46]', 'ref_id': 'BIBREF45'}]",[],Discussion
This study highlights the potential role of pDCs and the OX40-O40L axis in the protective antiviral response in MS. This mechanism could contribute to the balance between inflammation and immune regulation that could be therapeutically modulated in MS patients towards a protective immune response.,[],[],Discussion
Patients with a relapsing-remitting (RR)-MS inactive state according to established criteria [47] were enrolled in the study. All patients included in this study did not take immunomodulant or immunosuppressive compounds at least 2 months before recruitment. Approval by the ethics committee of the San Camillo Hospital (224/2015; 5 November 2015) and written informed consent in accordance with the Declaration of Helsinki from all participants were obtained before study initiation.,"[{'start': 93, 'end': 97, 'text': '[47]', 'ref_id': 'BIBREF46'}]",[],MS Subjects
"As controls, we used blood from age-and gender-matched individuals without inflammatory or degenerative diseases of the central or peripheral nervous system. These subjects were volunteers that underwent blood drawing.",[],[],MS Subjects
"Peripheral blood mononuclear cells (PBMC) were isolated by Ficoll gradient centrifugation (GE Healthcare, Little Chalfont, UK) from whole blood. PBMCs were cultured at a density of 1 × 10 6 cells/mL in 24-well plates (Corning, New York City, NY, USA) in RPMI 1640 with 10% of Fetal Bovine Serum (FBS), in the presence or absence of Resiquimod (R848) (Invivogen, San Diego, CA, USA) (100 ng/mL) for 6 hours at 37 • C. Then, cells were collected and stained with specific antibodies discriminating viable pDCs and mDCs and evaluating their expression of activation markers. After the isolation, the cells were stained with specific antibodies enabling to discriminate mDCs and pDCs.",[],[],Purification and Stimulation of Peripheral Blood Mononuclear Cells from Adult Blood
"PBMC were stained with the anti-CD4-FITC (Miltenyi; 1/100), and CD4 + T Lymphocytes were purified by immunomagnetic selection, using the anti-FITC isolation kit (Miltenyi, Bergisch Gladbach, Germany). After the isolation, the cells were stained with anti-CD4 FITC (Miltenyi; 1/100), anti-CD45RA BV421 (BD Biosciences, San Jose, CA, USA; 1/60), anti-CD45RO PE (BD Biosciences; 1/30), anti-CD27 APC (Miltenyi; 1/60), and CD4 + naive T-cells were sorted by a MoFlo high speed cell sorter (Beckman Coulter, Atlanta, GA, USA) as CD4 high , CD45RA high , CD45RO − , and CD27 + . Sorted cells had a purity of over 97%, measured by flow cytometry (data not shown). Naive CD4 + T-cells were cultured in 96-well round-bottomed plates (Corning) at a density of 5 × 10 4 per well in X-VIVO 15 serum-free medium (Lonza, Walkersville, MD, USA) in the presence of a Dynabeads CD3-CD28 T-cell expander (one bead per cell; Life Technologies, Carlsbad, CA, USA). TGF-β (5 ng/mL), IL-4 (50 ng/mL) (Miltenyi), and OX40L (RnD, Minneapolis, MN, USA) were used to stimulate naïve CD4 T cells. After 6 days, supernatants were collected for IL-9 quantification.",[],[],Purification and Stimulation of Naïve CD4 T Cells
IL-9 in culture supernatants was measured by IL-9 ELISA (Life Technologies) according to the manufacturer's instructions. ,[],[],Analysis of Cytokine Production
"For pair-wise comparisons of different conditions from the same donors or different donors, we used a non-parametric two-tailed paired or unpaired t-test, respectively. Data were presented as the mean ± standard error (SEM). The p values (p) of 0.05 or less were considered statistically significant.",[],[],Statistical Analysis
"Author Contributions: M.C. and G.R. performed the research and analyzed data; S.R., and C.G. provided samples of MS patients; L.B. contributed to the research design; E.V. designed the research, analyzed the data, and wrote the paper. ",[],[],Statistical Analysis
"The risk of acquiring nosocomial infections is a recognized problem in health-care facilities worldwide (Harbarth, Sax, & Gastmeier, 2003) . While the transmission routes for some diseases are well documented, the precise mode of transmission is uncertain for many infections, particularly for those pathogens that cause health-care-acquired infections (HCAIs). Although it is probable that the majority of transmission occurs via contact routes (Sax et al., 2009) , there is increasing recognition that the air plays an important role in disease spread (Li et al., 2007) . Understanding the role that ventilation airflow plays in the dispersion of infectious microorganisms is tantamount to assessing exposure to pathogens and hence infection risk. This study aims to provide an analytical link between airborne hospital infection spread, ventilation design, and outbreak management.","[{'start': 104, 'end': 138, 'text': '(Harbarth, Sax, & Gastmeier, 2003)', 'ref_id': 'BIBREF7'}, {'start': 446, 'end': 464, 'text': '(Sax et al., 2009)', 'ref_id': 'BIBREF23'}, {'start': 554, 'end': 571, 'text': '(Li et al., 2007)', 'ref_id': 'BIBREF13'}]",[],INTRODUCTION
"Ventilation has been found to have a significant impact on the distribution of infectious material in hospital settings. Examples include Influenza A (e.g. H5N1 and H7N9) (Reed & Kemmerly, 2009) , Mycobacterium tuberculosis (Escombe et al., 2010) , measles (Atkinson, Chartier, Pessoa-Silva, Jensen, & Li, 2009) , and norovirus (Teunis et al., 2008) . One of the most infamous examples occurred in 2003 during the severe acute respiratory syndrome (SARS) outbreak in Hong Kong. Analysis of airflow patterns and outbreak data demonstrated that ventilation routes were critical in the short-and long-range spread of aerosolized coronavirus (Li, Huang, Yu, Wong, & Qian, 2005) . Ventilation is recognized as an important infection control approach in health-care design, with strategies such as mechanical ventilation and pressure zoning set out in international ) and national guidance (Department of Health, 2007) .","[{'start': 171, 'end': 194, 'text': '(Reed & Kemmerly, 2009)', 'ref_id': 'BIBREF21'}, {'start': 224, 'end': 246, 'text': '(Escombe et al., 2010)', 'ref_id': 'BIBREF4'}, {'start': 257, 'end': 311, 'text': '(Atkinson, Chartier, Pessoa-Silva, Jensen, & Li, 2009)', 'ref_id': 'BIBREF0'}, {'start': 328, 'end': 349, 'text': '(Teunis et al., 2008)', 'ref_id': 'BIBREF25'}, {'start': 638, 'end': 673, 'text': '(Li, Huang, Yu, Wong, & Qian, 2005)', 'ref_id': 'BIBREF12'}, {'start': 884, 'end': 912, 'text': '(Department of Health, 2007)', 'ref_id': None}]",[],INTRODUCTION
"Evaluating the influence of ventilation on infection risk typically applies models such as the Wells-Riley equation (Riley, Murphy, & Riley, 1978) or a dose-response approach (Sze & Chao, 2010) to estimate the influence of ventilation on the number of new cases of an infection. Liao, Chang, and Liang (2005) presented a probabilistic transmission dynamic model to assess indoor airborne infection risks and Ko, Burge, Nardell, and Thompson (2001) and Ko, Thompson, and Nardell (2004) developed models for tuberculosis spread incorporating a zonal ventilation model. A number of authors have also looked at control strategies, including Wein and Atkinson (2009) , who modeled infection control measures for pandemic influenza; Brienen, Timen, Wallinga, Van Steenbergen, and Teunis (2010) , who analyzed the effect of mask use on the spread of influenza; and King, Noakes, and Sleigh (2015) , who developed a stochastic model to link airborne and contact transmission. It is also worth mentioning the recent work by Carruthers et al. (2018) , where a zonal ventilation model similar to the one considered in this article is linked to a dose-response approach to estimate the risk of infection after an accidental release of bacteria Francisella tularensis in a microbiology laboratory.","[{'start': 116, 'end': 146, 'text': '(Riley, Murphy, & Riley, 1978)', 'ref_id': 'BIBREF22'}, {'start': 175, 'end': 193, 'text': '(Sze & Chao, 2010)', 'ref_id': 'BIBREF24'}, {'start': 279, 'end': 308, 'text': 'Liao, Chang, and Liang (2005)', 'ref_id': 'BIBREF14'}, {'start': 408, 'end': 447, 'text': 'Ko, Burge, Nardell, and Thompson (2001)', 'ref_id': 'BIBREF10'}, {'start': 452, 'end': 484, 'text': 'Ko, Thompson, and Nardell (2004)', 'ref_id': 'BIBREF11'}, {'start': 637, 'end': 661, 'text': 'Wein and Atkinson (2009)', 'ref_id': 'BIBREF26'}, {'start': 727, 'end': 787, 'text': 'Brienen, Timen, Wallinga, Van Steenbergen, and Teunis (2010)', 'ref_id': 'BIBREF1'}, {'start': 858, 'end': 889, 'text': 'King, Noakes, and Sleigh (2015)', 'ref_id': 'BIBREF9'}, {'start': 1015, 'end': 1039, 'text': 'Carruthers et al. (2018)', 'ref_id': 'BIBREF2'}]",[],INTRODUCTION
"While these studies enable some understanding of the influence of the environment on transmission, they do not consider relationships between ventilation parameters and the progression and control of an infection outbreak. In an earlier study, it was demonstrated that the Wells-Riley model could be coupled to an SI epidemic model to relate ventilation rate and transmission in a fully mixed environment (Noakes, Beggs, Sleigh, & Kerr, 2006) . In later work, a zonal air distribution and a stochastic formulation (Noakes & Sleigh, 2009 ) was considered, and cost benefits of ventilation from an energy and infection risk perspective were explored (Noakes, Sleigh, & Khan, 2012) .","[{'start': 405, 'end': 442, 'text': '(Noakes, Beggs, Sleigh, & Kerr, 2006)', 'ref_id': 'BIBREF17'}, {'start': 514, 'end': 536, 'text': '(Noakes & Sleigh, 2009', 'ref_id': 'BIBREF18'}, {'start': 648, 'end': 678, 'text': '(Noakes, Sleigh, & Khan, 2012)', 'ref_id': 'BIBREF19'}]",[],INTRODUCTION
"The model presented in this article is constructed on a scenario defined in previous work (Noakes & Sleigh, 2009) , where the role played by the airflow during a nosocomial outbreak is assessed by linking a deterministic zonal ventilation model with an SI stochastic epidemic model using a computational approach. While the previous approach enabled exploration of the basic interaction between the ventilation and the outbreak, there are a number of limitations:","[{'start': 90, 'end': 113, 'text': '(Noakes & Sleigh, 2009)', 'ref_id': 'BIBREF18'}]",[],INTRODUCTION
"r The epidemic dynamics are represented through a simple SI epidemic model, not accounting for relevant factors such as the discharge and admission of patients, or the detection and declaration of the outbreak.",[],[],INTRODUCTION
"r Results reported by Noakes and Sleigh (2009) have high variability, which is related to the fact that they were obtained by means of stochastic simulations of the epidemic process.","[{'start': 22, 'end': 46, 'text': 'Noakes and Sleigh (2009)', 'ref_id': 'BIBREF18'}]",[],INTRODUCTION
"r The large number of parameters associated with each ventilation scenario makes it difficult to identify, from stochastic simulations, the specific factors of the ventilation air distribution that facilitate or mitigate epidemic spread.",[],[],INTRODUCTION
"We refer the reader to Keeling and Ross (2007) where the limitations of analyzing this type of epidemic processes by simulation are discussed in more detail, and where the benefits of following exact analytical approaches instead are highlighted.","[{'start': 23, 'end': 46, 'text': 'Keeling and Ross (2007)', 'ref_id': 'BIBREF8'}]",[],INTRODUCTION
"Our aim here is to show how this zonal ventilation model can be linked to more complex stochastic epidemic models for the spread of nosocomial pathogens, while accounting for patients, admission and discharge, and different outbreak detection and declaration hypotheses. We show how to implement exact analytical procedures for computing summary statistics of the outbreak (statistics measuring outbreak infectiousness), which by means of a perturbation analysis enables identification of specific characteristics of the ventilation setting that are crucial for the spread or control of the infection.",[],[],INTRODUCTION
"Finally, we carry out a comprehensive numerical study of six ventilation strategies for a hypothetical hospital ward in order to identify particular ventilation characteristics that may promote or inhibit spread of airborne nosocomial infections. Our results explore the interplay between ward ventilation, location of patients, ward overoccupancy, and outbreak detection management. Noakes and Sleigh (2009) propose a stochastic model that links a zonal ventilation model with epidemic dynamics by means of an SI model for the infection spread among individuals in a hospital setting. The combined model can be thought of as an adaptation of the Wells-Riley model (Riley et al., 1978; Sze & Chao, 2010) , where each susceptible individual is infected with a per capita rate,","[{'start': 384, 'end': 408, 'text': 'Noakes and Sleigh (2009)', 'ref_id': 'BIBREF18'}, {'start': 665, 'end': 685, 'text': '(Riley et al., 1978;', 'ref_id': 'BIBREF22'}, {'start': 686, 'end': 703, 'text': 'Sze & Chao, 2010)', 'ref_id': 'BIBREF24'}]",[],INTRODUCTION
"that is proportional to the number I of infective individuals. Here, Q is the room ventilation rate (m 3 /s), p is the pulmonary ventilation (breathing) rate (m 3 /s), and q is the unit of infection (quantum) as described by Riley et al. (1978) . In a standard SI stochastic epidemic model, where individuals are either susceptible or infective, individuals do not recover. This can be expressed in terms of a continuous-time Markov chain (CTMC) {S(t) : t ≥ 0}, where the random variable S(t) represents the number of susceptible individuals at time t, and the aim is to compute transient probabilities p S (t) = P(S(t) = S) for any S ∈ = {0, 1, . . . , N}, where N is the number of individuals in the population. These probabilities satisfy the Kolmogorov differential equations:","[{'start': 225, 'end': 244, 'text': 'Riley et al. (1978)', 'ref_id': 'BIBREF22'}]",[],THE MODEL
"Interevent times are assumed to be exponentially distributed and the stochastic process is simulated using the Gillespie algorithm (Gillespie, 1976) . In particular, this algorithm generates samples of the interevent times by using the fact that","[{'start': 131, 'end': 148, 'text': '(Gillespie, 1976)', 'ref_id': 'BIBREF5'}]",[],THE MODEL
and then updates the state of the system according to the probabilities of each possible event occurring.,[],[],THE MODEL
"In Noakes and Sleigh (2009) , this Wells-Riley process is adapted to investigate ventilation scenarios in a hypothetical hospital ward split in M ventilation zones. The air is assumed to be uniformly mixed within each zone; however, there is incomplete mixing between the zones and unbalanced zone boundaries allow for the effect of directional flow to be examined. In particular, the per capita infection rate λ k for susceptible individuals at zone k is defined as λ k = p k C k , where C k is the concentration of infectious material at zone k and p k is the pulmonary rate of these individuals. We note that this concentration could depend on the number of infected individuals, i j , in every zone 1 ≤ j ≤ M, due to airflow. In Noakes and Sleigh (2009) , the spatial distribution of infectious material is represented through the differential equation:","[{'start': 3, 'end': 27, 'text': 'Noakes and Sleigh (2009)', 'ref_id': 'BIBREF18'}, {'start': 733, 'end': 757, 'text': 'Noakes and Sleigh (2009)', 'ref_id': 'BIBREF18'}]",[],A Zonal Ventilation Model for Linking Airflow Dynamics and Infection Rates
"where V k is the volume of zone k, q k i k is the generation rate of infectious quanta, Q o,k represents the extract ventilation rate in zone k, and j β kj C k and j β jk C j amount to the volume flow of air between zones k and j. Moreover, each interzonal flow rate β kj represents the sum of two contributions:",[],[],A Zonal Ventilation Model for Linking Airflow Dynamics and Infection Rates
"where β 0 is a global mixing rate and β Qkj is an additional contribution representing net flow across the k/j zonal boundary, from zone k to zone j.",[],[],A Zonal Ventilation Model for Linking Airflow Dynamics and Infection Rates
"Equation (2) leads to a ventilation matrix that characterizes the ventilation air distribution under study,",[],[],A Zonal Ventilation Model for Linking Airflow Dynamics and Infection Rates
"representing ventilation in a hospital ward divided into M ventilation zones. By assuming steady-state conditions for airflow, and taking into account Equation (2), Noakes and Sleigh (2009) propose to link infection rates λ j , j ∈ {1, . . . , M} with the ventilation matrix V as follows: ⎛ (3)) that takes into account the ventilation distribution through matrix V. Once this procedure for computing infection rates is proposed, stochastic simulations for the SI epidemic dynamics are carried out in Noakes and Sleigh (2009) by following steps (i)-(iv) (Noakes & Sleigh, 2009 ), which assume exponentially distributed interevent times and make use of the property depicted in Equation (1). We note here that Equation (3) means considering per capita infection rates at each zone 1 ≤ j ≤ M as functions λ j (i 1 , . . . , i M ) of the number of infectives (i 1 , . . . , i M ) within each ventilation zone at the hospital ward. In Section 2.2, we now go on to exploit this, to link the zonal ventilation model with a multicompartment SI S model with detection, to evaluate the infection spread dynamics within the hospital ward until detection of the outbreak. Instead of carrying out stochastic simulations, we present an exact approach for analyzing a summary statistic of the outbreak: the total number of infections occurring until the outbreak ends or is detected and declared. This exact approach does not only allow us to compute this quantity of interest, but it also allows one to carry out a sensitivity analysis on the model parameters, so that the impact that different characteristics of the ventilation setting has on this summary statistic can be evaluated.","[{'start': 165, 'end': 189, 'text': 'Noakes and Sleigh (2009)', 'ref_id': 'BIBREF18'}, {'start': 501, 'end': 525, 'text': 'Noakes and Sleigh (2009)', 'ref_id': 'BIBREF18'}, {'start': 554, 'end': 576, 'text': '(Noakes & Sleigh, 2009', 'ref_id': 'BIBREF18'}]",[],A Zonal Ventilation Model for Linking Airflow Dynamics and Infection Rates
