text,cite_spans,ref_spans,section
"Three hundred and twenty-four NPA aliquots were stored beyond 3 months at 2 to 8°C before analysis in Nepal. Of these, we re-analyzed the 133 that yielded a negative result, now using the aliquot that had been frozen at -70°C and transported on dry ice to Norway. This was done at the Department of Microbiology and Infection Control, University Hospital of North Norway, Tromsø, Norway, using the Hexaplex Plus assay and an automated extraction platform (NucliSens ® easyMAG, bioMérieux, Durham, NC, USA). Nucleic acids were extracted from 400 μl of sample, negative and positive processing controls and amplification control using the extraction principle with magnetic particles of this platform.",[],[],Identification of respiratory RNA viruses
"The criteria for a positive test were OD 450 ≥ 0.400 and at least four times greater than the OD 450 of the negative control [22] . An OD 450 < 0.300 with an OD 450 of the internal control >2.00 indicated a negative test. A reading from 0.300 to 0.399 was interpreted as indeterminate and the sample examined again. If the same result was obtained on repeated testing, the NPA was deemed negative. If the OD 450 of the internal control for a given NPA was <2.00 and sample absorbance was < 0.400 for all tested agents, the NPA was tested again. If the same result was obtained on repeated testing, the interpretation was indeterminate due to potential inhibition, and the case not included in the analyses.","[{'start': 125, 'end': 129, 'text': '[22]', 'ref_id': 'BIBREF21'}]",[],Definitions of cut-off values and interpretation of PCR results
"The data were double entered and compared on a daily basis using Microsoft Visual FoxPro version 6.0 (Microsoft Corporation, Redmond, WA, USA). Statistical analyses were performed using Stata/MP 10.0 for Macintosh (Stata Corporation, College Station, TX, USA). The 95% confidence intervals (CI) for proportions were calculated with binominal exact confidence interval using the 'ci' command. Of the children included in this analysis, 274 were enrolled twice and 18 thrice. We used the 'cluster' option in Stata to adjust the confidence intervals of the proportions for repeated enrollments and thus allowed for possible dependence of observations in a child that was included more than once. Anthropometric measures were expressed as Z-scores, which were generated using the WHO Child Growth Standards 2005 [23] . Meteorological data for the Kathmandu airport weather station (located approximately 10 km from Bhaktapur) were obtained from Department of Hydrology and Meteorology, Ministry of Environment, Science and Technology, Kathmandu, Nepal. Mean daily values for relative humidity and temperature were calculated as the average of two daily measurements (relative humidity at 8.45 AM and 5.45 PM, and maximum and minimum temperature). We estimated the Spearman rank order correlation coefficient to describe the association between the monthly number of infections with each virus and meteorological factors.","[{'start': 808, 'end': 812, 'text': '[23]', 'ref_id': 'BIBREF22'}]",[],Data management and statistical analyses
The study had ethical clearance from the Research Ethics Committee of the Institute of Medicine at Tribhuvan University in Kathmandu and the Regional Committee for Medical and Health Research Ethics of Western Norway. The implementation of the project was in agreement with the international ethical principles for medical research involving human subjects as stated in the latest version of the Helsinki Declaration.,[],[],Ethical considerations
"We excluded 11 cases from the analysis due to inhibition of the PCR. Out of the remaining 2,219 pneumonia cases, Infection with more than one virus was identified in 29 (3.3%) of the 887 positive specimens. The most common double infection was PIV3 in combination with hMPV, which was found in nine cases. We identified three viruses in one case (PIV1, PIV2, RSV) and four viruses in another (PIV1, PIV2, InfB, RSV).",[],[],Results
"The occurrence of CAP during the course of our study exhibited substantial temporal variation and a clear epidemic pattern (Figure 2 ). In each of the three years, we observed a sharp increase in the occurrence of pneumonia at the end of the monsoon season in August to September. There were also significant CAP epidemics during winter, the first year peaking in February and the second year in December, but we observed no winter epidemic in the third year. There were also smaller peaks of CAP in spring. Epidemics of infection with individual respiratory viruses contributed to literally all of these CAP epidemics, such as the three RSV epidemics (the second of which was compounded by epidemics with InfA and InfB infections), an InfA epidemic superimposed on an hMPV epidemic, and a PIV3 epidemic ( Figure 3 ). Displays of the spatial-temporal distribution of these individual epidemics are visualized in [24] . PIV1 infections occurred in small numbers throughout the year, whereas only 17 cases of PIV2 infection were seen during the entire study period.","[{'start': 912, 'end': 916, 'text': '[24]', 'ref_id': None}]","[{'start': 123, 'end': 132, 'text': '(Figure 2', 'ref_id': None}, {'start': 806, 'end': 814, 'text': 'Figure 3', 'ref_id': None}]",Results
"The monthly distribution of RSV infections and meteorological data are shown in Figure 4 . The monthly number of RSV infections was positively correlated with relative humidity in the Spearman's correlation analysis, but not with temperature or rainfall ( Table 3 ). The same association with relative humidity was seen for hMPV. In contrast, the number of PIV3 was positively associated with both temperature and rainfall, and not with relative humidity. InfA did not correlate with any of these meteorological factors, while InfB showed moderate negative correlation with all three factors.",[],"[{'start': 80, 'end': 88, 'text': 'Figure 4', 'ref_id': None}, {'start': 256, 'end': 263, 'text': 'Table 3', 'ref_id': 'TABREF4'}]",Results
"This is to our knowledge the largest epidemiological study in almost four decades of childhood CAP in a developing country that identifies several common viruses. We isolated at least one viral pathogen using PCR from 40% of children during the 3-year study period. The literature reveals few studies based on sensitive molecular diagnosis from similar resource-poor settings. Apart from recent studies on hMPV, most previous studies in developing countries have not used PCR for virus detection [1] .","[{'start': 496, 'end': 499, 'text': '[1]', 'ref_id': 'BIBREF0'}]",[],Discussion
"Hospital-based studies in children <5 years of age from developing countries published over the last 20 years have identified viruses (excluding measles) in 8.4% [25] to 45% [26] of LRTI episodes. One of the larger studies, which included nearly 1,500 Pakistani children <5 years of age, detected a virus (including adenovirus) in 37% of cases using viral culture and immunofluorescence (IF) [27] . Previous community-based studies with longitudi-nal follow-up of children have identified viruses in 11% to 45% of LRTI cases [1, 28, 29] .","[{'start': 162, 'end': 166, 'text': '[25]', 'ref_id': 'BIBREF23'}, {'start': 174, 'end': 178, 'text': '[26]', 'ref_id': 'BIBREF24'}, {'start': 392, 'end': 396, 'text': '[27]', 'ref_id': 'BIBREF25'}, {'start': 525, 'end': 528, 'text': '[1,', 'ref_id': 'BIBREF0'}, {'start': 529, 'end': 532, 'text': '28,', 'ref_id': 'BIBREF26'}, {'start': 533, 'end': 536, 'text': '29]', 'ref_id': 'BIBREF27'}]",[],Discussion
"Not unexpectedly, RSV was by far the most common virus in our study, identified in 15.1% of all pneumonia cases and 37.7% of viral positive cases. Etiology studies in developing countries that included viruses have identified RSV in a median of 20% (5th to 95th percentile 1 to 53) of LRTI cases [30] and in 6% to 96% (mean 39%) of LRTI cases with a viral etiology [1] . It should be noted that many of these studies also included measles. A recently published denominator-based study from a birth cohort comprising 635 Kenyan children followed through three RSV epidemics reported that 13% of cases with LRTI were attributable to RSV infection, which was diagnosed using IF [31] . In India, RSV accounted for 17% of hospitalized cases with LRTI in New Delhi [32] and 7% of LRTI cases included in a 3-year longitudinal community study in Haryana [28] . After RSV, InfA and PIV3 were the most common viruses in our study, as reported elsewhere [1, 3, 28] . We detected hMPV in 4.2% of pneumonia cases. It is estimated that MPV worldwide accounts for 5 to 7% of ARI in young children requiring hospitalization [33] . In India, hMPV was detected in 3.2% of 662 children hospitalized for ARI over a 2-year period from April 2005 [34] .","[{'start': 296, 'end': 300, 'text': '[30]', 'ref_id': 'BIBREF28'}, {'start': 365, 'end': 368, 'text': '[1]', 'ref_id': 'BIBREF0'}, {'start': 675, 'end': 679, 'text': '[31]', 'ref_id': 'BIBREF29'}, {'start': 759, 'end': 763, 'text': '[32]', 'ref_id': 'BIBREF30'}, {'start': 846, 'end': 850, 'text': '[28]', 'ref_id': 'BIBREF26'}, {'start': 943, 'end': 946, 'text': '[1,', 'ref_id': 'BIBREF0'}, {'start': 947, 'end': 949, 'text': '3,', 'ref_id': 'BIBREF2'}, {'start': 950, 'end': 953, 'text': '28]', 'ref_id': 'BIBREF26'}, {'start': 1108, 'end': 1112, 'text': '[33]', 'ref_id': 'BIBREF31'}, {'start': 1225, 'end': 1229, 'text': '[34]', 'ref_id': 'BIBREF32'}]",[],Discussion
"RSV and influenza virus are known to occur in welldefined recurrent epidemics during the cold season in temperate climates [1, 2] . In tropical and subtropical areas, RSV infections have been reported to peak more often in relation to the wet season, but locations close to the equator show a less consistent pattern, some with almost continuous RSV activity and varying seasonal peaks [1, 7] . Studies in the Indian subcontinent have reported RSV infections to peak both in the cold season [27] and in the rainy season [35, 36] , as well as being detectable throughout the year [35, 37] . We observed RSV epidemics both in winter and during the monsoon. The virus was isolated during a period of 6 to 7 months and the epidemic peaks were observed with intervals of 15 and 9 months, which is consistent with patterns described elsewhere [31, 38] .","[{'start': 123, 'end': 126, 'text': '[1,', 'ref_id': 'BIBREF0'}, {'start': 127, 'end': 129, 'text': '2]', 'ref_id': 'BIBREF1'}, {'start': 386, 'end': 389, 'text': '[1,', 'ref_id': 'BIBREF0'}, {'start': 390, 'end': 392, 'text': '7]', 'ref_id': 'BIBREF6'}, {'start': 491, 'end': 495, 'text': '[27]', 'ref_id': 'BIBREF25'}, {'start': 520, 'end': 524, 'text': '[35,', 'ref_id': 'BIBREF33'}, {'start': 525, 'end': 528, 'text': '36]', 'ref_id': 'BIBREF34'}, {'start': 579, 'end': 583, 'text': '[35,', 'ref_id': 'BIBREF33'}, {'start': 584, 'end': 587, 'text': '37]', 'ref_id': 'BIBREF35'}, {'start': 837, 'end': 841, 'text': '[31,', 'ref_id': 'BIBREF29'}, {'start': 842, 'end': 845, 'text': '38]', 'ref_id': 'BIBREF36'}]",[],Discussion
"We detected influenza in 25 of the 36 study months. The largest influenza peaks occurred in winter from December to February in the first two years, but we also isolated influenza during the monsoon period. A summer outbreak of influenza has previously been reported from Nepal [39] . Surveillance data from 2007 at the Kathmandu sentinel site has showed that InfB was prevalent throughout the year except in May, and that InfA prevailed during June to August and reappeared in December [40] . Unlike in temperate regions, where influenza occurs in well-defined outbreaks lasting 2 to 3 months once a year in the winter, influenza is detectable for a greater part of the year in tropical and sub-tropical regions and the timing of outbreaks is less predictable [41, 42] . Influenza peaks have been reported to occur during periods of high rainfall in many tropical locations [12] .","[{'start': 278, 'end': 282, 'text': '[39]', 'ref_id': 'BIBREF37'}, {'start': 487, 'end': 491, 'text': '[40]', 'ref_id': 'BIBREF38'}, {'start': 761, 'end': 765, 'text': '[41,', 'ref_id': 'BIBREF39'}, {'start': 766, 'end': 769, 'text': '42]', 'ref_id': 'BIBREF40'}, {'start': 875, 'end': 879, 'text': '[12]', 'ref_id': 'BIBREF11'}]",[],Discussion
"We observed one distinct hMPV epidemic, which peaked between December 2004 and January 2005. The epidemic lasted from July 2004 to January 2005 and comprised 70% of the hMPV isolates detected during the entire 3year study period. Substantial variation in the yearly incidence of hMPV has also been reported earlier [43, 44] . Epidemics with this virus have been reported to occur during late winter to spring in temperate climates [33, 45] , including North India [46] , where the majority of hMPV were detected from December to February, and Korea [45] , where hMPV peaked between February and April. A study in subtropical Hong Kong found hMPV infections mainly in the spring and summer months [47] , similar to that of RSV [48] and occasionally influenza [49] .","[{'start': 315, 'end': 319, 'text': '[43,', 'ref_id': 'BIBREF41'}, {'start': 320, 'end': 323, 'text': '44]', 'ref_id': None}, {'start': 431, 'end': 435, 'text': '[33,', 'ref_id': 'BIBREF31'}, {'start': 436, 'end': 439, 'text': '45]', 'ref_id': 'BIBREF44'}, {'start': 464, 'end': 468, 'text': '[46]', 'ref_id': 'BIBREF45'}, {'start': 549, 'end': 553, 'text': '[45]', 'ref_id': 'BIBREF44'}, {'start': 696, 'end': 700, 'text': '[47]', 'ref_id': 'BIBREF46'}, {'start': 726, 'end': 730, 'text': '[48]', 'ref_id': 'BIBREF47'}, {'start': 758, 'end': 762, 'text': '[49]', 'ref_id': 'BIBREF48'}]",[],Discussion
"We isolated PIV3 in 27 months of our 36 month-study, but an increasing number of infections were seen between April to May and September each year, while the largest epidemic occurred in June 2006. The virus has been known to exhibit an endemic pattern and to cause yearly epidemics in spring and summer in temperate climates [50] . PIV1 was isolated in smaller numbers throughout the study period (in 28 of 36 months), and we could not observe the biennial pattern of fall epidemics seen elsewhere [51] .","[{'start': 326, 'end': 330, 'text': '[50]', 'ref_id': 'BIBREF49'}, {'start': 499, 'end': 503, 'text': '[51]', 'ref_id': 'BIBREF50'}]",[],Discussion
"As could be observed from the displays of the occurrence of viral CAPs in the study children [24] , the spatial-temporal distribution of these infections revealed more or less overlapping micro-epidemics with several respiratory viral pathogens spreading between households in Bhaktapur.","[{'start': 93, 'end': 97, 'text': '[24]', 'ref_id': None}]",[],Discussion
"Despite two of the three RSV epidemics occurring during the summer monsoon, neither rainfall nor temperature was significantly associated with RSV infections in our study, while there was a positive correlation with relative humidity. In tropical Asian countries, somewhat contradictory patterns of associations between RSV and meteorological factors have been observed. In Hong Kong, the monthly incidence of RSV infection was positively correlated with both temperature and relative humidity [48] , whereas in Malaysia, the number of RSV infections was inversely correlated with temperature [52] . RSV infections peaked towards the end of the rainy season during the first and third year of our study. We explored whether there could be an association between preceding rainfall and RSV infections, and by introducing a 2-month lag after peak precipitation, such an association could indeed be identified (data not shown).","[{'start': 494, 'end': 498, 'text': '[48]', 'ref_id': 'BIBREF47'}, {'start': 593, 'end': 597, 'text': '[52]', 'ref_id': 'BIBREF51'}]",[],Discussion
"A strong association with relative humidity was also found for hMPV infections. Association with meteorological factors has not previously been described for this virus. Belonging to the Pneumovirinae subfamily [53] , both RSV and hMPV could require similar conditions for transmission and infectivity. In contrast, PIV3 was strongly and positively correlated with both temperature and rainfall, but not with relative humidity. A study in Singapore found no such associations for PIV3 [54] . It is also interesting to note that, in our study, InfB infections showed an inverse correlation with relative humidity, temperature and rainfall, while InfA infections did not correlate with any of these meteorological factors. In Singapore, InfA outbreaks were also not associated with meteorological factors, but InfB infections were reported to positively correlate with rainfall [54] .","[{'start': 211, 'end': 215, 'text': '[53]', 'ref_id': 'BIBREF52'}, {'start': 485, 'end': 489, 'text': '[54]', 'ref_id': 'BIBREF53'}, {'start': 876, 'end': 880, 'text': '[54]', 'ref_id': 'BIBREF53'}]",[],Discussion
"As derived from the correlation analyses (r s = 0.68), up to 46% of the monthly variation in occurrence of viral infections in our study could be explained by meteorological factors. However, the underlying reasons for the observed seasonal patterns demonstrated by these individual respiratory viruses are unclear. Climate could have a direct impact on virus survival, transmission efficiency, and host immunity, or have an indirect effect through climatedependent behavior change, such as indoor crowding and eating habits [55] . We detected more than one virus in 3.3% of the virus-positive NPA specimens, which is similar to what is reported using molecular methods detecting the same viruses as in our study [56] , but lower compared with studies using molecular methods detecting a wider array of viruses [57, 58] . The frequency of viral co-detections varies widely and depends on the number of diagnostic methods applied [59] and the number of pathogens tested for [58] . By employing multiplex PCR assays for 11 viruses, a study in 515 Korean children aged ≤ 5 years detected viruses in 312 (60.6%) of cases and a viral co-detection in 36 (11.5%) [45] . In addition to the seven viruses identified in our study, the Korean study also detected adenovirus, coronavirus, rhinovirus, and bocavirus; and, notably, the last virus was identified in 22 of the 36 co-detections. The clinical role of bocavirus in pneumonia in otherwise healthy children is unclear [60, 61] , as is the importance of multiple viral infections [57, 59] . Quantitative PCR methods to determine viral load in clinical specimens could provide valuable information on the pathogenetic role of each virus in such co-detections [61] , as could case-control studies.","[{'start': 525, 'end': 529, 'text': '[55]', 'ref_id': 'BIBREF54'}, {'start': 713, 'end': 717, 'text': '[56]', 'ref_id': 'BIBREF55'}, {'start': 811, 'end': 815, 'text': '[57,', 'ref_id': 'BIBREF56'}, {'start': 816, 'end': 819, 'text': '58]', 'ref_id': 'BIBREF57'}, {'start': 929, 'end': 933, 'text': '[59]', 'ref_id': 'BIBREF58'}, {'start': 973, 'end': 977, 'text': '[58]', 'ref_id': 'BIBREF57'}, {'start': 1156, 'end': 1160, 'text': '[45]', 'ref_id': 'BIBREF44'}, {'start': 1464, 'end': 1468, 'text': '[60,', 'ref_id': 'BIBREF59'}, {'start': 1469, 'end': 1472, 'text': '61]', 'ref_id': 'BIBREF60'}, {'start': 1525, 'end': 1529, 'text': '[57,', 'ref_id': 'BIBREF56'}, {'start': 1530, 'end': 1533, 'text': '59]', 'ref_id': 'BIBREF58'}, {'start': 1703, 'end': 1707, 'text': '[61]', 'ref_id': 'BIBREF60'}]",[],Discussion
"Compared with pneumonia, pulmonary tuberculosis is not common in young Nepalese children [62] . To avoid including cases of undiagnosed tuberculosis and reactive airway disease, we did not include children that had been coughing for more than 14 days and we reassessed respiratory rate in wheezers after salbutamol administration before diagnosis of pneumonia [20] . The number of measles cases in Nepal has decreased dramatically since 2003 [63] . Measles vaccination is recommended at 9 months and the vaccine coverage among those that were 9 months or older in our study area was >90% (unpublished data). Moreover, less than 1% of our cases had a rash and all of these were above 1 year of age. Thus, we believe that our sample consisted of children with pneumonia, and not tuberculosis, bronchial asthma, or measles.","[{'start': 89, 'end': 93, 'text': '[62]', 'ref_id': 'BIBREF61'}, {'start': 360, 'end': 364, 'text': '[20]', 'ref_id': 'BIBREF19'}, {'start': 442, 'end': 446, 'text': '[63]', 'ref_id': 'BIBREF62'}]",[],Discussion
"Despite the high sensitivity and specificity of the Hexaplex Plus assay [15] , we may have underestimated the number of viral infections. Viral load in a specimen depends on several conditions, such as time of collection in relation to onset of illness. In most of the study children, the NPA specimen was collected early in the course of illness, which increases the likelihood of detecting an infectious agent [14] . Moreover, by not including children who had taken antibiotics during the last 48 hours, we primarily recruited new cases of pneumonia. Using multiplex instead of single molecular assays may have contributed to an underestimation of the number of viral CAP cases, as some loss of sensitivity is an inherent limitation of multiplex PCR assays [13] .","[{'start': 72, 'end': 76, 'text': '[15]', 'ref_id': 'BIBREF14'}, {'start': 412, 'end': 416, 'text': '[14]', 'ref_id': 'BIBREF13'}, {'start': 760, 'end': 764, 'text': '[13]', 'ref_id': 'BIBREF12'}]",[],Discussion
"We observed a large month-to-month variation in the proportion of CAP cases from whom we identified a res- piratory RNA virus, largely reflecting the epidemic pattern of viral infections in this sub-tropical setting. A limitation of our study was that we were not able to include more etiologic agents in our diagnostic panel. Adenovirus is among the more common viral respiratory pathogens causing LRTI in preschool children [64] . Atypical bacteria, like Mycoplasma pneumoniae, cause pneumonia more frequently in school-age children, but can also cause mild infections in younger children [65] . Streptococcus pneumoniae and Haemophilus influenza are the main bacterial pathogens causing childhood pneumonia. However, nasopharyngeal carriage of these bacteria is frequent in healthy, young children [66] . Moreover, their detection in pneumonia is hampered by the difficulties of obtaining specimens from the lower airways and the low sensitivity of identifying these pathogens by blood culture [67] , and such invasive methods are not well suited for community settings. S. pneumoniae has been suggested to play a role in the development of virus-associated pneumonia in children in hospital, especially in cases with influenza and PIV types 1 to 3 [68] . The monthly number of cases where we did not identify any virus was particularly pronounced in the CAP epidemic that peaked in December 2005 (Figure 2) , which comprised the largest outbreaks of influenza A and B (Figure 3 ). There is abundant evidence that infection with influenza viruses predisposes for pneumococcal disease [69] . Additionally, we cannot rule out the possibility that some of the cases where we detected a viral pathogen in fact had a mixed viral-bacterial pneumonia or pneumonia after acquisition of a new pneumococcal serotype during an upper respiratory viral infection. Again, quantitative PCR methods and carefully conducted casecontrol studies could shed light on the clinical importance of detecting viral pathogens in NPA specimens from children with pneumonia.","[{'start': 426, 'end': 430, 'text': '[64]', 'ref_id': 'BIBREF63'}, {'start': 591, 'end': 595, 'text': '[65]', 'ref_id': 'BIBREF64'}, {'start': 801, 'end': 805, 'text': '[66]', 'ref_id': 'BIBREF65'}, {'start': 997, 'end': 1001, 'text': '[67]', 'ref_id': 'BIBREF66'}, {'start': 1252, 'end': 1256, 'text': '[68]', 'ref_id': 'BIBREF67'}, {'start': 1587, 'end': 1591, 'text': '[69]', 'ref_id': 'BIBREF68'}]","[{'start': 1400, 'end': 1410, 'text': '(Figure 2)', 'ref_id': None}, {'start': 1472, 'end': 1481, 'text': '(Figure 3', 'ref_id': None}]",Discussion
"We detected a viral pathogen from the nasopharynx in 40% of the children with CAP in this study, indicating that respiratory RNA viruses play an important role in this common childhood illness in Nepal. RSV was the most common agent isolated, and occurred with considerable temporal variation. As for many other common childhood infections, such as diarrhea, the occurrence of viral CAP in this community seemed to reflect more or less overlapping micro-epidemics with several respiratory viruses, highlighting the challenges of developing and implementing effective public health control measures in resource-poor settings. Research and Education (NUFU project number PRO 36/2002) . The sponsors of the study had no role in study design, data collection, data analysis, data interpretation, or writing of the report. The corresponding author had full access to all the data in the study and had final responsibility for the decision to submit for publication.","[{'start': 669, 'end': 681, 'text': 'PRO 36/2002)', 'ref_id': None}]",[],Conclusion
