text,cite_spans,ref_spans,section
"It has been previously shown that CoV nsp13 interacts with both RNA and DNA in a sequence-independent manner [29, 35, 36] . To analyze the nucleic acid binding pocket of MERS-CoV nsp13, we generated a model of nsp13-ssRNA based on the superposition of the helicase domain of nsp13 with the helicase domains of hUpf1, scUpf1 [26] and EAV nsp10 [25] . The model shows that while the 3' end of single-stranded RNA is located in the channel formed by 1B, Stalk and RecA1 domains; the 5' end of the RNA lies on top of RecA2 domain (Fig 6A) . Although the helical insertion equivalent to the Upf1 1C domain is missing in nsp13, the protein has a topologically equivalent loop between β17 and β18 which fulfills similar function in RNA binding. The β17-β18-loop makes direct contacts with 1B domain, forming the 3' end outlet of the putative RNA binding channel. The narrowest opening of the putative RNA binding channel has the width and height of 6 and 12Å, which is just enough to accept a single-stranded RNA or DNA (Fig 6B) . The dimension of the RNA binding channel of nsp13 is similar to that in EAV nsp10, but smaller than the channel in Upf1. Based on structural Crystal structure of MERS-CoV nsp13 comparisons, we predicted the residues of nsp13, which are likely involved in RNA recognition (S2 Fig & S1 Table) . Their structural equivalents are mostly conserved in EAV nsp10 and Upf1 helicases, suggesting that CoV nsp13 adopts the similar mechanism for nucleic acids binding.","[{'start': 109, 'end': 113, 'text': '[29,', 'ref_id': 'BIBREF28'}, {'start': 114, 'end': 117, 'text': '35,', 'ref_id': 'BIBREF34'}, {'start': 118, 'end': 121, 'text': '36]', 'ref_id': 'BIBREF35'}, {'start': 324, 'end': 328, 'text': '[26]', 'ref_id': 'BIBREF25'}, {'start': 343, 'end': 347, 'text': '[25]', 'ref_id': 'BIBREF24'}]","[{'start': 526, 'end': 534, 'text': '(Fig 6A)', 'ref_id': 'FIGREF5'}, {'start': 1013, 'end': 1021, 'text': '(Fig 6B)', 'ref_id': 'FIGREF5'}, {'start': 1299, 'end': 1307, 'text': 'Fig & S1', 'ref_id': 'FIGREF0'}, {'start': 1308, 'end': 1314, 'text': 'Table)', 'ref_id': None}]",A model of MERS-CoV nsp13 in complex with single stranded RNA
"Structural comparisons of the individual domains of Upf1-like helicases using Dali server showed that the CH of MERS-CoV nsp13 is structurally closer to the CH of Upf1 than to the ZBD of EAV nsp10. In accordance with previously published results, the structure of the helicase cores is well conserved in all three Upf1-like helicases (Table 2) . However, some subtle differences could also be identified. Firstly, while the helicase cores of MERS-CoV nsp13 and Upf1 have similar size, the helicase core of EAV nsp10 is more compact. MERS-CoV nsp13 contains seven and five parallel β-strands in RecA1 and RecA2 domains, respectively, Upf1 has seven and six β-strands in the RecA1 and RecA2 domain, respectively, whereas EAV nsp10 has only five and four β-strands in the RecA like domains. Secondly, while three Upf1 like helicases all contain the 1B domain with the β-barrel fold, only Upf1 has a helical 1C insertion in RecA1 domain. The equivalent 1C insertion is missing in both EAV nsp10 [25] and MERS-CoV nsp13 (Fig 4D and 4E) . Thirdly, CoVs nsp13 does not contain a C-terminal domain homologous to the C-terminal portion of EAV nsp10 (C-terminal 65 residues), which was shown to regulate ATPase and helicase activities [25] . The sequence conservation analysis showed that the C-terminal domain of arteriviruses and CoVs is indeed poorly conserved [25] . Our crystallographic study provides the complete structure of the extreme C-terminal region of MERS-CoV nsp13, which shows that the C-terminus is an integral part of the RecA2 domain. Thus, we conclude that the C-terminal regulatory domain outside SF1 helicase core is completely missing in MERS-CoV nsp13 and other CoVs helicases. Previous mutagenesis studies of CoVs nsp13 have identified a collection of residues essential to the activity of nsp13. Because nsp13 helicase is highly conserved among CoVs, the crystal structure of MERS-CoV nsp13 can provide three-dimensional information to understand previous phenotypes of nsp13 mutants. It has been shown that mutations of the conserved Cys/His at ZBD of 229E-CoV nsp13 interfered with its ATPase activity [32] . Ala or Arg replacement of C5003, C5021, C5024 and H5028 abolished or reduced the ATPase activity of 229E-CoV nsp13. Our crystal structure of MERS-CoV nsp13 confirms that these residues, corresponding to C8, C26, C29 and H33 of MERS-CoV nsp13 (Fig 4C) are coordinating Zn1 and Zn2. The loss of ATPase activity caused by Cys/His substitutes can be attributed to the disruption of zinc-binding and the integrity of the CH domain. Unexpectedly, only C5050A mutant retained significant ATPase activity (~60%). Based on the comparison with corresponding C55 of MERS-CoV nsp13, C5050 of 229E-CoV coordinates Zn3 of the ZBD. Zn3 is the most distantly located zinc from the helicase core (6.4Å away from Zn2; Fig 1A) , and the ZBD/CH is tightly attached to the helicase core in CoV nsp13, it is therefore unsurprising that the impaired binding of Zn3 has the minimal effect on the enzymatic activity of nsp13 [32] . This hypothesis is supported by the mutagenesis study of EAV nsp10 [25, 32] , which also showed that while mutant H2414A (ligand for Zn3) retained residual ATPase/ helicase activity and wild-type-level nucleic acid binding activity, the activities of mutants C2395A (ligand for Zn1) and H2399A (ligand for Zn2) was completely abolished.","[{'start': 991, 'end': 995, 'text': '[25]', 'ref_id': 'BIBREF24'}, {'start': 1225, 'end': 1229, 'text': '[25]', 'ref_id': 'BIBREF24'}, {'start': 1354, 'end': 1358, 'text': '[25]', 'ref_id': 'BIBREF24'}, {'start': 2121, 'end': 2125, 'text': '[32]', 'ref_id': 'BIBREF31'}, {'start': 3028, 'end': 3032, 'text': '[32]', 'ref_id': 'BIBREF31'}, {'start': 3102, 'end': 3106, 'text': '[25,', 'ref_id': 'BIBREF24'}, {'start': 3107, 'end': 3110, 'text': '32]', 'ref_id': 'BIBREF31'}]","[{'start': 334, 'end': 343, 'text': '(Table 2)', 'ref_id': 'TABREF1'}, {'start': 1015, 'end': 1030, 'text': '(Fig 4D and 4E)', 'ref_id': 'FIGREF3'}, {'start': 2370, 'end': 2378, 'text': '(Fig 4C)', 'ref_id': 'FIGREF3'}, {'start': 2828, 'end': 2835, 'text': 'Fig 1A)', 'ref_id': 'FIGREF0'}]",Discussion
"Recently, Zhang et al found that mutation A335V of MHV nsp13 led to attenuation of virus growth in cells and resulted in~30 fold reduced viral titer in the livers of infected mice [33] . Residue A335 of MHV nsp13 is highly conserved among CoVs nsp13 (S2 Fig). Based on the crystal structure of MERS-CoV nsp13, A335 (corresponding to A336 of MERS-CoV nsp13) is located on the β17-β18-loop, a loop interacts with the 1B domain as well as participates in the formation of RNA binding channel. Because A335 is highly exposed to the surface of nsp13, Valine replacement could increase hydrophobicity of this region. Therefore, A335V mutation may impair the function of nsp13 by destabilizing the local structure critical to RNA binding or promoting aggregation of the protein.","[{'start': 180, 'end': 184, 'text': '[33]', 'ref_id': 'BIBREF32'}]","[{'start': 254, 'end': 259, 'text': 'Fig).', 'ref_id': None}]",Discussion
"In summary, our current study presents the first structural insight into the multiple functionality of the CoV nsp13. Our analyses demonstrate that while the domain organization of MERS-CoV nsp13 and EAV nsp10 is conserved, the structures of the individual domains of nsp13 are closely related to their eukaryotic equivalents in Upf1 helicase. While the interaction between the CH (or ZBD) domain and the helicase core presents the most distinctive feature differentiating nidovirus helicases from the Upf1 helicases, the high resemblance between the CH domains of MERS-CoV nsp13 and Upf1 helicases is remarkable. This structural similarity not only supports a hypothesis that nidoviruses helicase may have a Upf1-like role in posttranscriptional quality control of viral RNAs synthesis [25] , but also implies a possibility that CoV nsp13 might use its Upf1-similar CH domain to interfere with nonsense-mediated mRNA decay (NMD) pathway. It has already been shown that NMD targets viral RNAs for degradation in the early phase of infection of +RNA viruses [37] . Based on the coevolution of virus and host mechanism, the viruses also develop strategies to suppress NMD. Nevertheless, whether CoV nsp13 is involved in NMD suppression requires experimental evidence. To investigate what proteins bind nsp13 through its CH domain and how do they modulate nsp13 function is important to expand our knowledge about the evolution and function of Upf1-like helicases. Finally, our results provide novel structural information essential for structure-based drug design against CoV.","[{'start': 787, 'end': 791, 'text': '[25]', 'ref_id': 'BIBREF24'}, {'start': 1057, 'end': 1061, 'text': '[37]', 'ref_id': 'BIBREF36'}]",[],Discussion
"The gene encoding full-length MERS-CoV nsp13 helicase (1-598aa, GeneBank accession: YP_009047202) was amplified by polymerase chain reaction (PCR) and inserted via BamHI/ XhoI restriction sites into a modified pFastbac-1 baculovirus transfer vector with an N-terminal 6×His-SUMO tag [38] . Nsp13 protein was overexpressed in High-5 insect cells using Bacto-Bac Baculovirus Expression System (Invitrogen). One liter cell culture (2.0×10 6 cells ml -1 ) was infected with 30 ml baculovirus at 22˚C. Forty-eight hours after infection, cells were harvested by centrifugation. The cell pellet was re-suspended in a lysis buffer containing 25mM Tris-HCl (pH 7.5), 1.5 M NaCl and 15mM imidazole and lysed by ultrasonification. High salt concentration in the lysis buffer was necessary to remove nucleic acids bound to nsp13. Protein was purified using Ni-NTA resin (QIAGEN). The eluted protein was digested with Pre-Scission protease (GE healthcare) to remove the 6×His-SUMO tag. Finally, the untagged nsp13 was purified using size-exclusion chromatography (Superdex-200, GE healthcare). The purified nsp13 was concentrated to~8 mg/ml in the buffer containing 10mM HEPES (pH 7.0) and 100mM NaCl. Before crystallization trials, nsp13 was mixed with 5'-triphosphate 15 thymine single-stranded DNA (ppp-15T) with 1:1.5 molar ratio and incubated at 4˚C overnight. Crystallization of nsp13 was achieved by mixing equal volume of sample and reservoir buffer (1.0μl) containing 0.1 M Tris-HCl (pH 8.5), 1M (NH 4 ) 2 SO 4 and 15% glycerol. The crystals were grown in a hanging-drop vapor-diffusion system at 18˚C.","[{'start': 283, 'end': 287, 'text': '[38]', 'ref_id': 'BIBREF37'}]",[],"Protein expression, purification and crystallization"
"5'-triphosphate DNA (ppp-15T) was synthesized and purified according to previously published procedures [39, 40] . Briefly, ppp-15T oligonucleotide was analyzed by LC/ESI-MS on a XBridge C8 column (2.1 x 50 mm, 2.5μm). Buffer A was 95mM 1,1,1,3,3,3-hexafluoro-2-propanol, 16mM triethylamine in water and buffer B was 100% methanol. A gradient from 2% to 29% B over 26.8 min with flow rate of 0.25 mL/min was employed at a column temperature of 60˚C. A DNAPac-200 column (4 x 250 mm) was used for analytical IE-HPLC. Buffer A was 25mM Tris-HCl, 1mM EDTA in 10% acetronitrile (pH = 8) and buffer B was buffer A plus 1 M sodium bromide. A gradient of 25 to 56% B over 21.5 min at a flow rate of 1.0 mL/min was used at a column temperature of 75˚C. Final purity by IE-HPLC and LC/ESI-MS was above 94% (S3 Fig) .","[{'start': 104, 'end': 108, 'text': '[39,', 'ref_id': 'BIBREF38'}, {'start': 109, 'end': 112, 'text': '40]', 'ref_id': 'BIBREF39'}]","[{'start': 801, 'end': 805, 'text': 'Fig)', 'ref_id': None}]",Oligonucleotide synthesis
"Prior to crystallization trials nsp13 protein was incubated with a 5'-triphosphate singlestranded DNA containing 15T (ppp-15T). Highly redundant multi-wavelength anomalous diffraction data were collected using the X-ray with wavelengths close to the absorption edge of zinc (Hrem: 1.2810Å, Peak: 1.2827Å and Infl: 1.2831Å). Crystal belonged to the space group P6 1 22, and contained two molecules per ASU. An interpretable electron density map was calculated using SHARP/autoSHARP [41] . An initial model of MERS-CoV nsp13 was manually built using Coot [42] . Finally, a native data with highest resolution (3.0Å) was collected using the X-rays with the wavelength of 0.978Å. Higher resolution structure was solved by molecular replacement using the initial nsp13 structure as the searching model. The 3.0Å structure was refined using PHENIX [43] . In the final model, 145-230aa (the entire 1B domain) of molecule A are disordered, probably due to mobility of 1B and the lack of crystal contacts, whereas in molecule B, 591 out of 598 amino acids were located in the electron density maps (S4 Fig).","[{'start': 481, 'end': 485, 'text': '[41]', 'ref_id': 'BIBREF40'}, {'start': 553, 'end': 557, 'text': '[42]', 'ref_id': 'BIBREF41'}, {'start': 842, 'end': 846, 'text': '[43]', 'ref_id': 'BIBREF42'}]",[],Structure determination
"ATPase assay was carried out as previously described [44] . Briefly, reaction mixtures (50μl) containing 100mM Tris-HCl (pH 8.0), 4mM MgCl 2 , trace amount of [γ-32 P]ATP (~1nM) and the specified amount of ATP (from 10μM to 320μM) were incubated at 30˚C. The reaction was initiated by the addition of MERS-CoV nsp13 (20nM). At each indicated time point, 2μl of quenching buffer (0.5M EDTA) was added to the mixture to stop the reaction. Finally, 1μl the sample was spotted on the thin-layer chromatography cellulose TLC plates (Sigma-Aldrich) and resolved with running buffer containing 0.8M acetate and 0.8M LiCl. The plates were dried and analyzed using storage phosphor screen and Typhoon Trio Variable Mode Imager (GE healthcare). ATP turnover was quantified using ImageQuant TL software (GE Healthcare).","[{'start': 53, 'end': 57, 'text': '[44]', 'ref_id': 'BIBREF43'}]",[],ATPase assay
"The reaction mixture (10μl) contained 50mM HEPES (pH 7.5), 5mM MgCl 2 , 2mM dithiothreitol (DTT), 1mM nucleotide (ATP, GTP, CTP or TTP), 50nM of partial duplex RNA substrate and 300nM unlabeled trap RNA (5'-CGAAGCUGCUAACAUCAG-3') [36] . The RNA substrate with 5' overhang is prepared by mixing a top strand: 5'-UUUUUUUUUUCUGAU GUUAGCAGCUUCG-3' with a bottom strand: 5'-HEX-CGAAGCUGCUAACAUCAG-3'. The RNA substrate with 3' overhang is prepared by mixing a top strand: 5'-CUGAUGUUAG CAGCUUCGUUUUUUUUUUUUUUUUUUUU-3' with the same bottom strand as in RNA partial duplex with 5' overhang. The reaction was initiated by the addition of MERS-CoV nsp13 (100nM) and incubated at 30˚C for 30 minutes. The reaction was terminated by addition of 2.5μl loading buffer (5X) containing 100 mM Tris-HCl (pH7.5), 1% SDS, 50mM EDTA and 50% glycerol. Samples were resolved by 10% native-PAGE running on ice. The gel was scanned with Typhoon Trio Variable Mode Imager (GE healthcare).","[{'start': 230, 'end': 234, 'text': '[36]', 'ref_id': 'BIBREF35'}]",[],Helicase assay
"Multiple sequence alignment was carried out using MUSCLE software (http://www.ebi.ac.uk/ Tools/msa/muscle/). In some region, minor manual adjustments were performed in accordance to the structural superimposition of the Upf1 like helicases. The illustration of sequence alignment was either generated using ESPript 3.0 (http://espript.ibcp.fr/ESPript/ESPript/), or produced manually using Microsoft PowerPoint. The structural alignment was carried out using Dali server (http://ekhidna.biocenter.helsinki.fi/dali_server). ",[],[],Sequence and structure alignments
"In many longitudinal studies, some information might not be measured/available for the whole cohort, in fact biomarkers/additional covariates, or even outcome, might be ascertained only in selected subsamples. These studies are part of a broad category termed two-phase studies [1] , in fact they imply two sampling phases: the first one being usually a random sample from the target population, ending up in the entire cohort (phase I sample), and the second one applying some kind of sampling (e.g. efficient or of convenience) to collect additional information or the selection of subjects with no missing data and expensive new technologies make it infeasible to measure the biomarkers on the entire cohort. The Women's Health Initiative program, for example, stored serum and plasma from participants and used them for specialized studies [9] . Also the Cardiovascular Health Study collected DNA from most participants to study different genetic factors underlying cardiovascular or other diseases and only subsets of the cohort have been genotyped in different projects [10] .","[{'start': 278, 'end': 281, 'text': '[1]', 'ref_id': 'BIBREF0'}, {'start': 844, 'end': 847, 'text': '[9]', 'ref_id': 'BIBREF8'}, {'start': 1076, 'end': 1080, 'text': '[10]', 'ref_id': 'BIBREF9'}]",[],Background
"In our first motivating clinical example, the aim was to evaluate the role of different genetic polymorphisms on treatment failure due to relapse in childhood acute lymphoblastic leukemia (ALL) using clinical information and biological samples available from a clinical trial that enrolled nearly 2000 patients. In this situation, a parsimonious use of these specimens motivated the choice of an efficient/optimal two-phase sampling design [11] . We present also a further application where the aim was to estimate engagement to care of HIV patients in resource limited settings. Here the outcome itself was missing in a group of patients due to possibly informative loss to follow-up. The outcome was tracked in a random sample of those lost to follow-up to obtain a valid estimate of engagement to care [12] .","[{'start': 440, 'end': 444, 'text': '[11]', 'ref_id': 'BIBREF10'}, {'start': 805, 'end': 809, 'text': '[12]', 'ref_id': 'BIBREF11'}]",[],Background
"For two-phase studies, appropriate weighted survival estimates have been derived, both in the presence of additional covariates measured in the second phase [7, 13, 14] , as well as in cohorts where the outcome/follow-up is not available for everyone [15] . A Cox model adapted for twophase designs has also been derived [14] . However no estimator of cumulative incidence accounting for competing events in the general framework of two-phase designs has been proposed, while it has been developed for specific designs, such as nested case-control studies [16, 17] . This is relevant in the presence of multiple types of events, such as relapse and (toxic) death in cancer patients, as in the motivating examples presented here, where estimation of event type specific quantities are needed for evaluating outcome.","[{'start': 157, 'end': 160, 'text': '[7,', 'ref_id': 'BIBREF6'}, {'start': 161, 'end': 164, 'text': '13,', 'ref_id': 'BIBREF12'}, {'start': 165, 'end': 168, 'text': '14]', 'ref_id': 'BIBREF13'}, {'start': 251, 'end': 255, 'text': '[15]', 'ref_id': 'BIBREF14'}, {'start': 321, 'end': 325, 'text': '[14]', 'ref_id': 'BIBREF13'}, {'start': 556, 'end': 560, 'text': '[16,', 'ref_id': 'BIBREF15'}, {'start': 561, 'end': 564, 'text': '17]', 'ref_id': 'BIBREF16'}]",[],Background
"The aim of this paper is to develop a non parametric estimator of the crude incidence of events accounting for possible competing events in the general framework of two-phase designs, where subgroups of analysis might be defined according to explanatory variables ascertained in the phase II sample, or the outcome itself assessed only in the second phase sample.",[],[],Background
"In the Methods section we propose a weighted crude incidence estimator for application in two-phase designs. The theoretical properties of the proposed method are derived in appendix and investigated through simulations under different scenarios, which results are reported in Results section. In this section we also report the examples on childhood ALL and HIV patients. Conclusions is dedicated to the discussion.",[],[],Background
"Let T be the failure time variable and suppose there are K possible causes of failure denoted by ε = 1, 2, . . . K. Let the cause-specific hazard function of the k th event be:",[],[],Notation and basics
and,[],[],Notation and basics
"as the probability that a failure due to cause k occurs by time t, that is the quantity that we aim to estimate. Define also S(t) = P(T > t) = 1 − k F k (t) as the probability of surviving from any cause of failure. A convenient representation of the crude incidence function (1) as product limit estimator naturally arises starting from the subdistribution hazard introduced by Gray [18] and defined as:","[{'start': 384, 'end': 388, 'text': '[18]', 'ref_id': 'BIBREF17'}]",[],Notation and basics
"This hazard has been shown to be very useful to compare the crude cumulative hazard functions in different groups, since it restores a one-to-one relationship between the hazard and the cumulative probability of a particular failure type:",[],[],Notation and basics
"s)ds and where the product integral notation is used to suggest a limit of finite products [18, 19] . Of note, the one-to-one relationship between the hazard and the cumulative probability is not satisfied from the cause-specific hazard in the presence of competing events [20] . The subdistribution hazard can be thought as the hazard of an artificial variable T * k = T · I {ε = k} + ∞ · I {ε = k} that extends to infinity the time to event k when another competing event is observed. In fact, for any finite t, T * k ≤ t is equivalent to T ≤ t and ε = k; thus, given definition (1),","[{'start': 91, 'end': 95, 'text': '[18,', 'ref_id': 'BIBREF17'}, {'start': 96, 'end': 99, 'text': '19]', 'ref_id': 'BIBREF18'}, {'start': 273, 'end': 277, 'text': '[20]', 'ref_id': 'BIBREF19'}]",[],Notation and basics
"The definition of T * k is consistent with the argument that when an event other than k occurs as first, the latter will never be observed as first and thus the corresponding time is infinity.",[],[],Notation and basics
Let,[],[],Notation and basics
"be N independent replicates of (T, ε, C, Z), where C is the censoring time and Z a vector of covariates. We will refer to these N subjects as the phase I sample. Define X = min(T, C) and = I(T ≤ C). We will assume that failure and censoring times are conditionally independent,",[],[],Notation and basics
where I(·) is the indicator function. Define G(t) = P(C > t) as the probability to remaining uncensored up to t.,[],[],Notation and basics
"Suppose that complete information on (X i , i ε i , Z i ) is available only for a subset n < N of subjects drawn based on a possibly complex sampling design and let ξ i indicate whether subject i is selected into this sample. We will refer to the n = i ξ i subjects as the phase II sample, even if multiple phases of sampling could actually be involved to obtain the final complete sample [7] . Let π i = P(ξ i = 1|X i , i ε i , Z i ) being the inclusion probability of subject i for the phase II sample, conditional on being selected at the first phase. In a random sample this probability is equal for every subject. However sampling is often stratified on some variables to increase efficiency; in this case, the probability to be selected for the phase II sample is common for all subjects in the same stratum and differs between strata. In particular, it is usually higher for the more informative strata (e.g. strata including subjects with the event of interest as in case-control studies). For nested case-control designs the sampling probability of cases will be 1, while the one of controls might be derived as the probability that individual i is ever selected as control, following Samuelsen [4] . We denote the pairwise sampling probability for any two subjects (i, j,","[{'start': 389, 'end': 392, 'text': '[7]', 'ref_id': 'BIBREF6'}, {'start': 1204, 'end': 1207, 'text': '[4]', 'ref_id': 'BIBREF3'}]",[],Notation and basics
"As commonly assumed in survey theory, the sampling method should have the following properties: the sampling probabilities π i and π ij must be non zero for all i, j in the population and must be known for each i, j in the sample [7] .","[{'start': 230, 'end': 233, 'text': '[7]', 'ref_id': 'BIBREF6'}]",[],Notation and basics
"Under a two-phase design it is common to be interested in estimating survival in subgroups related to variables ascertained only in phase II sample (i.e. biomarkers). Another possible situation is that, instead of covariates, the outcome itself is not available for the whole cohort. Thus, in both cases an estimate of the incidence of event using only the phase II sample is very useful. The total number of events of type k up to t and the total number of persons at risk at time t for the entire phase I sample can be estimated from the phase II sample (accounting for the sample design) byN",[],[],Incidence estimation in the presence of competing risks Overall survival/incidence estimate
", respectively. Note that these estimates are valid under general sampling designs, where π i and π ij , the so-called 'design weights' , are known for the observations actually sampled [21] .","[{'start': 186, 'end': 190, 'text': '[21]', 'ref_id': 'BIBREF20'}]",[],Incidence estimation in the presence of competing risks Overall survival/incidence estimate
The estimate of the overall survival has been shown by several authors in different contexts of complex sampling [13] [14] [15] :,"[{'start': 113, 'end': 117, 'text': '[13]', 'ref_id': 'BIBREF12'}, {'start': 118, 'end': 122, 'text': '[14]', 'ref_id': 'BIBREF13'}, {'start': 123, 'end': 127, 'text': '[15]', 'ref_id': 'BIBREF14'}]",[],Incidence estimation in the presence of competing risks Overall survival/incidence estimate
